記事,タイトル,URL,サマリー
0,Twitter広告で個人ユーザーの投稿を盗用 化粧品メーカーが謝罪 「運用は広告会社に委託していた」,https://www.itmedia.co.jp/news/articles/2307/05/news133.html,化粧品メーカーのプレミアアンチエイジング（東京都港区）は7月4日、同社と無関係な個人ユーザーのツイートを無断でまねし、Twitter広告を作ったとして謝罪した。同社は該当の投稿をした広報アカウントを削除。広告の制作とTwitterアカウントの運用は広告会社に任せていたと説明している。問題のTwitter広告は6月29日に投稿したもの。同社のブランド「クレイエンス」のヘアカラーを宣伝する内容だった。しかし、Twitter上ではこの広告の文面などが、2020年に投稿された個人のツイートと酷似していると指摘され、物議を醸していた。その後、同社は問題のツイートを削除し、Twitterアカウントも削除した。プレミアアンチエイジングによると、Twitter広告の制作・運用は広告会社のピアラ（東京都渋谷区）に委託していたという。一方で「広告会社の管理や投稿内容の確認が十分ではなかった」と認め、再発防止に努めるとしている。プレミアアンチエイジングの声明ピアラも4日に声明を発表。他ユーザーの過去のツイートを盗用したことを認めて謝罪した。同社は「広告を作成するに当たり、当社の広告運用に対する認識が欠如していた」と説明。再発防止のため、この事案を社内で周知し、社内のモラルの向上や広告内容の管理フローを見直すとしている。ピアラの声明
1,TBSがゲーム事業に参入 オリジナルIP創造に向け協力事業者を募集,https://www.itmedia.co.jp/news/articles/2307/05/news121.html,TBSテレビは7月5日、ゲーム事業への本格参入に向け、ブランド「TBS GAMES」を立ち上げたと発表した。「心や生活を豊かにするゲームを作り、有名ゲームキャラクターのように、世界中で親しまれるオリジナルIPの創造を目指す」としている。TBSグループのコンテンツ創造力を武器に、モバイル、アーケード、カードゲームなど広い意味のゲーム事業に参入。同日に公開したティーザーサイトでは「ご興味を持たれた企業様はご連絡ください」と、協力事業者を募集している。TBSテレビの番組がゲームになった例としては「炎の体育会TV」「どうぶつ奇想天外！」などがある。今後発売するゲームや関連情報はティーザーサイトで順次発信していく。これまでにゲーム化されたテレビ番組
2,製造業向けクラウドのキャディが118億円調達 2030年までに主力サービスの売上1兆円目指す,https://www.itmedia.co.jp/news/articles/2307/05/news119.html,製造業向けクラウドサービスを手掛けるキャディ（東京都台東区）は7月5日、ベンチャーキャピタルなどから約118億円の資金を調達したと発表した。資金はサービスの機能強化に充てる他、人材採用に活用する。中でも主力サービスの「CADDi MANUFACTURING」では、2030年までに売上1兆円規模を目指すという。資金はベンチャーキャピタルのグロービス・キャピタル・パートナーズ（東京都千代田区）に加え、SMBCグループや三菱UFJグループのベンチャー向けファンドなどから調達。これにより、キャディの調達総額は約217億3000万円になった。キャディは2017年創業。産業装置用部品などの受発注プラットフォームであるCADDi MANUFACTURINGに加え、22年からはデータ化した図面の管理・活用が可能なクラウドサービス「CADDi DRAWER」を提供している。海外でのサービス提供にも注力しており、米国、ベトナム、タイでも事業を展開している。
3,Google、ネット上の公開情報をAIのトレーニングに利用しているとプライバシーポリシーに明記,https://www.itmedia.co.jp/news/articles/2307/05/news080.html,米Googleは7月1日、プライバシーポリシーを更新した。Googleが公開している更新の差分を確認できるページによると、変更があったのは日付を除いて2箇所。1つ目は「コンテンツや広告など、カスタマイズしたサービスの提供」という条項で、以前は「たとえば、「マウンテンバイク」というキーワードで検索すると、Googleが配信する広告を表示するサイトを閲覧しているときにスポーツ用品の広告が表示されることがあります。」となっていたところが「たとえば、「マウンテンバイク」というキーワードで検索すると、YouTubeでスポーツ用品の広告が表示されることがあります。」と変更された。2つ目は、ユーザーが公開した情報の収集に関する条項だ。本文内の「公開情報」の定義を説明するリンク先が以下のように変わっている。日本語では、「たとえば、インターネットに一般公開されている情報やその他の公開情報源からの情報を収集し、Googleの言語モデルの学習やGoogle翻訳などの機能の構築に役立てることがあります。」が「たとえば、インターネットに一般公開されている情報やその他の公開情報源からの情報を収集し、GoogleのAIモデルのトレーニングのほか、Google翻訳、Bard、CloudのAI機能などのサービスや機能の構築に役立てることがあります。また、ビジネスの情報がウェブサイトで公開されている場合は、インデックスに登録してGoogleサービスに表示することもあります。」となった。つまり、収集するデータやその利用方法については変わらないが、従来より具体的に明示するようになった。Twitterのオーナー、イーロン・マスク氏は多数の組織がAIのトレーニングのためにTwitterから情報をスクレイピングしていると非難したが、Googleは自社のAIツールのトレーニングにネット上に一般公開されている情報をすべて使っているということだ。
4,東大、生成AIシンポジウムのアーカイブ動画を公開 孫正義氏「日本は真正面からAI開発に取り組むべき」,https://www.itmedia.co.jp/news/articles/2307/05/news114.html,東京大学は7月4日、同日に開催した生成AIシンポジウムのアーカイブ動画を公開した。イベントにはソフトバンクグループの孫正義代表取締役会長兼社長や東大の松尾豊教授、西村康稔経済産業大臣、米OpenAI幹部のシェイン・グウさんらが登壇。孫会長は「日本は今こそ真正面からAI開発に取り組むべきだ」と訴えた。シンポジウムに登壇した孫正義氏テーマは「生成AIが切り拓く未来と日本の展望」。人間を超えて進化していくAIについて不安を覚えるという意見に対し、孫氏は「不安に思い過ぎる必要はない」とし「幸いなことにAIはタンパク質ではなく電気を食べる。だからAIには人類を取って食べる動機がないし、神様や仏様のように賢くて聡く、愚かなことはしない。だから日本は安心して真正面から最大限にAI開発に取り組むべきだ」と語った。他にも「行政機関（政府・自治体）における生成 AIの利用と課題」や「広島AIプロセスについて」「生成AIと研究・教育」などのセッションも実施。これらのアーカイブ動画も公開している。
5,「アイドルマスター」公式Twitterの一部が突如消失 「デレステ」や「シャニマス」など 原因不明【復旧済み】,https://www.itmedia.co.jp/news/articles/2307/05/news108.html,メディアミックス作品「アイドルマスター」に関する公式Twitterアカウントの一部が突如、閲覧できない状態になった。7月5日正午時点で「シンデレラガールズ スターライトステージ」（＠imascg_stage）「シャイニーカラーズ」（＠imassc_official）「ミリオンライブ！ シアターデイズ」（＠imasml_theater）の3アカウントが「このアカウントは存在しません」と表示される状態になっている。同じアイドルマスターシリーズの公式Twitterアカウントで、影響を受けなかった「シンデレラガールズ【ブランド公式】」（＠imas_CGofficial）などは、現在詳細を調査中と説明。詳しい原因については明かしていない。Twitterを巡っては、7月1日に閲覧制限が突如掛かるなど、急な仕様変更が相次いでいる。アイドルマスターファンの中には、Twitter側に原因があるのではないかと疑う人も見られる。同日午後1時40分ごろ、復旧発表シンデレラガールズ スターライトステージ公式Twitterは同日午後1時42分ごろ、アカウントの復旧を報告。他の2つのアカウントも閲覧可能な状態へ戻った。
6,Yahoo!ショッピングに定期購入機能 値付けやポイントで差別化も,https://www.itmedia.co.jp/news/articles/2307/05/news106.html,ヤフーは7月5日、ECモール「Yahoo!ショッピング」で、お米や水などの日用品を利用者が指定した頻度で定期的に届ける「定期購入」の提供を始めた。発注の手間が省け、買い忘れもなくなるとしている。定期購入の対象商品はカートに入れる際に通常購入か定期購入かを選べる商品が定期購入の対象だった場合、利用者は「配送頻度」と「次回お届け日」を指定できる。次回お届け日の15日前になると案内メールが届き、11日前までなら配送予定日や支払い方法の変更、解約なども行える。支払い方法はYahoo!ウォレットに登録されたクレジットカードもしくは「PayPayあと払い」、商品代引。対象商品は商品検索の絞り込み機能などで探せる。一方の出店社は、リピート率の高い商品などを任意に定期購入商品に指定し、通常とは異なる価格やポイントを設定できる。またヤフーによると、今後は専用クーポン機能などの追加も予定しているという。お届け頻度は1日単位で設定できる
7,フランス、Googleに3億円の罰金 消費者に必要な情報を提供しなかったとして,https://www.itmedia.co.jp/news/articles/2307/05/news100.html,フランス政府は7月4日（現地時間）、米Googleが消費者に適切な情報提供を行わなかったとして同社アイルランド支部に201万5000ユーロ（約3.2億円）の罰金を求める行政処分をしたと発表した。消費者に明確かつ公平で透明性のある情報を提供しなかったとしてフランスは2021年にGoogleを調査。Google検索においては、結果表示順の決定方法を提示していない点、ホテルなどの宿泊プランを検索してもキャンセルや返金が可能かなどの情報を適切に表示できない点などの問題が見つかった。GooglePlayにおいては、検索結果の表示順を決定する基準を提示していない、アプリ提供者や支払情報などの情報が不足している、レビューを掲載しない場合に拒否理由を示さないといったことが分かった。一部の問題は修正が完了している。
8,サイボウズがベンチャーキャピタル組成 生成AI・Web3スタートアップを支援へ,https://www.itmedia.co.jp/news/articles/2307/05/news082.html,サイボウズは7月4日、ベンチャーキャピタル「kintone Teamwork Fund」を組成し、出資や支援を希望する企業の募集を開始した。同社のクラウドサービス「kintone」との連携を前提に、Web3や生成AIなどを活用するスタートアップを支援していくという。出資対象はアーリーかミドルステージ（成長の初期〜中期）にあるスタートアップ。（1）Web3や生成AIといった技術を活用しており、kintoneとのシナジーが見込める、（2）社会インフラ、医療、農業など、kintoneが普及していない業界向け、（3）海外市場向け──といった条件を満たすサービスに出資するという。出資額は1社につき1000万円〜1億円程度で、2025年までに20〜30社を支援する予定。支援のイメージ出資対象には資金だけでなく、kintoneの無料ライセンスや、拡販の支援なども提供するという。サイボウズはスタートアップとの連携を通して「kintoneエコシステムのさらなるなる拡大を目指す」としている。
9,Twitterは「開発頼まれても断りたいレベル」？ エンジニア視点で意見続々,https://www.itmedia.co.jp/news/articles/2307/05/news077.html,Twitterは、「エンジニア視点で見ると、作ってと言われたら断りたいほどめんどくさいしろもの」――ドワンゴ取締役／ニコニコ代表の栗田穣崇（くりた・しげたか）さんのこんなツイートがきっかけで、Twitterを開発する難しさについて、エンジニアたちが意見を交わしている。栗田さんは、「Twitterのタイムラインはユーザーから見ると『ツイート並べてるだけでしょ？』みたいに簡単なサービスに見えるけど、エンジニア視点で見ると、作ってと言われたら断りたいほどめんどくさいしろもの」とツイート。Twitter代替サービスがなかなか出てこない理由として、開発が大変なこと、維持費が大いのにマネタイズが難しいことを挙げた。ニコニコ動画の開発に初期から関わっている戀塚昭彦さんは、栗田さんの投稿を引用しつつ、「最近のTwitterは多機能、大規模、高速を全部兼ね備えてるので、ちょっとやそっとじゃ真似できない」「すごい小規模ならある程度は簡単に作れそうでも、ユーザー数とリアルタイム性によって実現してる『場』が成立しない」と述べた。他のエンジニアからも、Twitterのリアルタイム性や、数億人というユーザー規模、大規模データベース管理などの視点から、開発や維持は「絶対にやりたくない」といった意見が続々と出ている。
10,スマホアプリの“ゾンビアカウント”削除してる？ 7割超が保持 米中の研究者が調査：Innovative Tech,https://www.itmedia.co.jp/news/articles/2307/05/news035.html,"中国の南開大学と米Indiana University Bloomingtonに所属する研究者らが発表した論文「How Are Your Zombie Accounts？ Understanding Users’ Practices and Expectations on Mobile App Account Deletion」は、使わなくなったモバイルアプリにおけるアカウント削除に関する調査を行った研究報告である。ユーザーのアカウント削除に対する意識や実践、期待を探るために、2つの国（米国279人、中国368人）を対象とした647人の参加者によるオンライン調査と、さらに20人の参加者による現地インタビューを実施した。このアンケートは、60の人気モバイルアプリのアカウント削除プロセスに関する実証的な測定に基づいて設計されている。結果は以下に示す通りである。まず、オンライン調査では、ほとんどの参加者が個人情報保護のために行動することに積極的であり（89％）、アプリを使わなくなったときにアプリベンダーにデータを使われ続けることを望んでいない（95％）と回答した。しかし、アンインストールしたアプリのアカウント状況について尋ねた結果、「1〜2回しか使わず、もう使わないかもしれないのでアンインストールした」を選択した人（86％）は、「もう使わないアプリをアンインストールする前にしていることは何ですか」という質問に対して、アカウントを削除した人は3分の1以下（26％、145人／554人）で、半数以上（57％、314人／554人）が「何もしない」と回答した。総合的には、75％が“ゾンビアカウント”を保持しているという結果となった。アカウント削除に関するユーザーの理解を調査する中で次のようなことが分かった。ほとんどの参加者の認知は、アプリベンダーの主張とは異なり、例えば、半数以上の参加者が、アカウント削除後も個人情報は削除されない（57％）、削除は元に戻せる（61％）と考えていた。また45％の参加者が、利用停止とはデータを削除することだと誤解していた。ゾンビアカウントのリスク、知ってる？次に、ゾンビアカウントのリスクを知っているか、ゾンビアカウントによるトラブルを経験したことがあるかを尋ねた結果、半数以上の参加者が懸念を表明した。懸念を表明した参加者ほど、実際にアカウントを削除する可能性が高いことが分かった。10％の参加者が、アカウントを適時に削除しないことによる影響を経験したことがある、または聞いたことがあると回答。そのうちの一部（56％、35／63人）は、トラブルの経験を回答した。参加者が遭遇したトラブルは、（1）メール、メッセージ、電話などのしつこい宣伝プッシュ（60％、21／35人）、（2）他社からの嫌がらせメッセージ（34％、12／35）、（3）自動課金など金銭的損失（6％、2／35）の3種類に集約できた。他にも「初めてアプリを使ったのに、他人のアカウントを使ってしまった」という経験の有無を聞いた結果、22％の人が「ある」と回答した。アカウント削除ページには簡単にたどり着けない？次に、アカウント削除に失敗した理由として、62％（62人／100人）の参加者が、「アカウント削除の選択肢がなかった、少なくとも簡単には発見できなかった」と回答した。また、58％（58／100人）の人が「手順が多すぎてうまく削除できなかった」と回答した。アカウント削除の操作が不親切に設計されていることが、かなりの数の参加者のアカウント削除を妨げていること分かった。WhatsAppアカウント削除方法アカウント削除について詳しく説明されていると思われるプライバシーポリシーをどの程度見ているかを尋ねた結果、「読んだことがない」（37％）、「ざっと見たことがある」（56％）という回答が多かった。分析すると、アカウント削除までに平均して1つのアプリにつき13.04回のクリックが必要であることが分かった。最も困難な例では、Weiboのアカウント削除エントリーを得るために72回もクリックする必要があった。この過程で、約半数（50％）の参加者（20人中の10人）が検索エンジンの助けを借り、3人（15％）がカスタマーサービスに助けを求めた。アプリの中には、アプリ外での削除操作（Webサイトへのアクセスやメール送信など）が必要なものもあるが、追加の質問を行った結果、91％（279人中の253人）の参加者がアプリ内でアカウント削除ができることを希望していた。わざわざブラウザを立ち上げてWebサイトにログインする必要がないことが求められている。アプリの中には削除処理をしてからすぐに削除されるのではなく、数日後に削除するアプリも多くある。アカウント削除申請後に削除を撤回する機能を望むかを尋ねた。その結果、44％の人が「すぐに個人情報が削除されること」を期待していた。また、ほぼ全員（90％、584人／647人）が7日以内のデータ削除を希望していた。アプリの平均的な削除期間は14.75日であり、最も短いものは即時削除で、最も長いものは1年かかるものであった。自由回答の中で、24％（327人中80人）の参加者がアカウント削除の実際の影響について懸念を示した。アカウント削除後、データが完全に削除されたことを確認することは非常に重要だが、一般のユーザーとしては、それを確認することは困難である。長期間ログインしない場合に自動的にアカウントが削除されるベンダーが存在することを観察した。そのため、オンライン調査では、参加者がこのアカウント削除に関連するサービスについてどのように考えているかを尋ねた。調査結果から、参加者の46％が前向きな姿勢を持っていることが分かった。Source and Image Credits: Yijing Liu, Yan Jia, Qingyin Tan, Zheli Liu, and Luyi Xing.
How Are Your Zombie Accounts？ Understanding Users’ Practices and Expectations on Mobile App Account Deletion."
11,脳波から画像を生成するAI「DreamDiffusion」 テンセント含む中国の研究者らが開発：Innovative Tech,https://www.itmedia.co.jp/news/articles/2307/05/news037.html,"中国の清華深セン国際大学院、Tencent AI Lab、Peng Cheng Laboratoryに所属する研究者らが発表した論文「DreamDiffusion: Generating High-Quality Images from Brain EEG Signals」は、脳波（EEG）から高品質でリアルな画像を生成する拡散モデルを提案した研究報告である。提案手法は、EEGデータセットから学習した知識と画像拡散モデルの生成能力を利用する。脳波信号からStable Diffusionを利用して画像を生成人の脳から拡散モデルを利用して画像を生成するアプローチはこれまでにも研究されてきた。例えば、阪大などが開発したシステムなどだ。しかし、その多くは、磁気共鳴機能画像法（fMRI）により得られた脳活動から画像を生成するアプローチを採用している。そのため、専門家の操作が必要な上、高価で持ち運びが困難なfMRI装置を必要とし、実用的ではない。これに対して脳波は、非侵襲的かつ低コストで脳の電気活動を記録する方法である。EEG信号を簡便に取得できるポータブルな市販製品も登場している。この研究では、脳波信号で事前に訓練したテキストから画像への拡散モデル「Stable Diffusion」を用い、画像を生成する手法を提案する。しかし、脳波信号を活用するには課題も多い。例えば、脳波信号は非侵襲的に捉えられるため本質的にノイズが多い。また、脳波データは限られており個人差も無視できない。CLIPの使用と多数のテキストと画像ペアに対するトレーニングのおかげで、Stable Diffusionにおけるテキスト空間と画像空間はよく整列している。だがノイズの多い脳波と画像のペアを用いて、脳波、テキスト、画像の空間をどのように整列させるのかが問題となる。この問題に対して研究者らは、主に3つのモジュールからなるシステムを構築する。（1）ノイズの多い脳波データから情報を抽出するEEGエンコーダーのためのマスク信号の事前訓練、（2）Stable Diffusionを用いた、EEGと画像のペアからなるデータセットによる微調整、（3）追加のCLIPエンコーダーを用いたEEG、テキスト、画像の空間の整列、となる。DreamDiffusionのパイプライン今回使用したEEGと画像のペアデータは、6人の被験者がImageNetデータセットから40の異なるカテゴリーのオブジェクトに属する2000枚の画像を見せられながら記録された脳波のコレクションである。そのため、40カテゴリーに限定されていることに留意したい。この手法の精度を評価するため、類似の最新研究（Brain2Image）と定性的に比較した実験を行った。結果、Brain2Imageによって生成した画像よりも著しく精度が高いことが確認でき、提案手法の有効性を示した。Source and Image Credits: Yunpeng Bai, Xintao Wang, Yanpei Cao, Yixiao Ge, Chun Yuan, and Ying Shan.
DreamDiffusion: Generating High-Quality Images from Brain EEG Signals"
